{"$schema":"https://json-schema.org/draft/2020-12/schema","$id":"https://playaig.com/schemas/game-version.schema.json","type":"object","additionalProperties":false,"required":["id","slug","name","shortDescription","description","status","verificationStatus","sourceIds","gameVersionId","imageAssetIds","createdAt","updatedAt","lastVerifiedAt","notes","versionNumber","releaseDate"],"properties":{"id":{"type":"string","pattern":"^[a-z][a-z0-9]*(?:-[a-z0-9]+)*$"},"slug":{"type":"string","pattern":"^[a-z0-9]+(?:-[a-z0-9]+)*$"},"name":{"type":"string","minLength":1},"shortDescription":{"type":["string","null"]},"description":{"type":["string","null"]},"status":{"enum":["unknown","current","historical"]},"verificationStatus":{"enum":["verified","partially-verified","unverified"]},"sourceIds":{"type":"array","items":{"type":"string"},"uniqueItems":true},"gameVersionId":{"type":["string","null"]},"imageAssetIds":{"type":"array","items":{"type":"string"},"uniqueItems":true},"createdAt":{"type":"string","format":"date-time"},"updatedAt":{"type":"string","format":"date-time"},"lastVerifiedAt":{"type":["string","null"],"format":"date-time"},"notes":{"type":["string","null"]},"versionNumber":{"type":["string","null"]},"releaseDate":{"type":["string","null"],"format":"date-time"}}}
