[
  {
    "id": "version-unknown",
    "slug": "unknown",
    "name": "Unknown",
    "shortDescription": null,
    "description": null,
    "status": "unknown",
    "verificationStatus": "unverified",
    "sourceIds": [],
    "gameVersionId": null,
    "imageAssetIds": [],
    "createdAt": "2026-08-01T00:00:00Z",
    "updatedAt": "2026-08-01T00:00:00Z",
    "lastVerifiedAt": null,
    "notes": "Version placeholder. No version number or release date is asserted by this data model.",
    "versionNumber": null,
    "releaseDate": null
  }
]
